selection_rank	paper_id	doi	year	journal	title	species	tissue	figure_count	panel_count	tools_observed	skill_tags	digest_path
165	S0166	10.1186/s12943-025-02231-y	2025	Mol Cancer	Comprehensive single-cell atlas of colorectal neuroendocrine tumors with liver metastases: unraveling tumor microenvironment heterogeneity between primary lesions and metastases.		liver;tumor	8	12	Monocle:6;GSEA:2;Seurat:1;Harmony:1	spatial_programs:10;publication_plotting:9;spatial_domain:8;cell_type_mapping:7;developmental_trajectory:5;spatial_cell_type_interpretation:5;cell_cell_interaction:5;spatial_communication:5	paper_digests/papers/S0166.md
166	S0167	10.1186/s12967-024-06011-y	2024	J Transl Med	Spatial transcriptomics reveals unique metabolic profile and key oncogenic regulators of cervical squamous cell carcinoma.		carcinoma	6	6	cell2location:2;GSEA:2;GSVA:2;SAW:1;Seurat:1;Scanpy:1;CellPhoneDB:1;scVelo:1;pySCENIC:1;Harmony:1	spatial_domain:6;publication_plotting:4;spatial_programs:3;cell_type_mapping:2;spatial_grn_regulon:2;cell_cell_interaction:1;developmental_trajectory:1;spatial_communication:1	paper_digests/papers/S0167.md
167	S0168	10.1186/s12974-024-03161-0	2024	J Neuroinflammation	Integrating single-nucleus RNA sequencing and spatial transcriptomics to elucidate a specialized subpopulation of astrocytes, microglia and vascular cells in brains of mouse model of lipopolysaccharide-induced sepsis-associated encephalopathy.	mouse	brain	6	11	RCTD/spacexr:2;SAW:1;Seurat:1;GSEA:1	publication_plotting:7;cell_type_mapping:5;spatial_cell_type_interpretation:5;spatial_programs:4;quality_control_preprocessing:3;spatial_domain:3;cell_cell_interaction:3;spatial_communication:3	paper_digests/papers/S0168.md
168	S0169	10.1186/s13024-025-00887-0	2025	Mol Neurodegener	MS4A6A/Ms4a6d deficiency disrupts neuroprotective microglia functions and promotes inflammation in Alzheimer's disease model.			5	18		publication_plotting:3;spatial_domain:1;spatial_programs:1	paper_digests/papers/S0169.md
169	S0170	10.1186/s13046-024-03238-x	2025	J Exp Clin Cancer Res	Antibody-based delivery of interleukin-2 modulates the immunosuppressive tumor microenvironment and achieves cure in pancreatic ductal adenocarcinoma syngeneic mice.	mouse	liver;tumor;carcinoma	7	7	SAW:1;Stereopy:1;SingleR:1;GSEA:1	publication_plotting:5;quality_control_preprocessing:2;3d_reconstruction:1;cell_cell_interaction:1;spatial_communication:1;spatial_programs:1;spatial_domain:1	paper_digests/papers/S0170.md
170	S0171	10.1186/s13073-025-01475-z	2025	Genome Med	Spatiotemporal single-cell analysis elucidates the cellular and molecular dynamics of human cornea aging.	human		6	7	GSEA:5;SAW:1;Seurat:1;RCTD/spacexr:1;CellChat:1;pySCENIC:1;Harmony:1	publication_plotting:6;spatial_programs:5;developmental_trajectory:4;spatial_domain:4;cell_type_mapping:2;cell_cell_interaction:2;spatial_communication:2;spatial_grn_regulon:1;spatial_cell_type_interpretation:1	paper_digests/papers/S0171.md
171	S0172	10.1200/jco.2025.43.16_suppl.6025	2025	Journal of Clinical Oncology	Using longitudinal spatial-omics to demonstrate in-situ Epstein-Barr virus reduction in responders to immunotherapy treated nasopharyngeal cancer.		cancer	0	0			paper_digests/papers/S0172.md
172	S0173	10.1200/jco.2025.43.16_suppl.e20030	2025	Journal of Clinical Oncology	Decoding spatial transcriptomics-based heterogeneity of TME in early-stage invasive pulmonary adenocarcinoma.		carcinoma	0	0			paper_digests/papers/S0173.md
173	S0174	10.1242/dev.204346	2025	Development	Morphogenic, molecular and cellular adaptations for unidirectional airflow in the chicken lung.		lung	0	0			paper_digests/papers/S0174.md
174	S0175	10.1364/oe.510835	2024	Opt Express	High-robustness autofocusing method in the microscope with laser-based arrayed spots.			0	0			paper_digests/papers/S0175.md
175	S0176	10.24272/j.issn.2095-8137.2023.205	2024	Zool Res	Spatially resolved transcriptomic profiling of placental development in dairy cow.	bovine	placenta	7	7	SAW:1;Seurat:1;CellChat:1;Harmony:1	spatial_domain:3;cell_cell_interaction:2;spatial_cell_type_interpretation:2;spatial_communication:2;developmental_trajectory:1;spatial_programs:1	paper_digests/papers/S0176.md
176	S0177	10.3389/fcell.2022.1060298	2022	Front Cell Dev Biol	Resolving the gene expression maps of human first-trimester chorionic villi with spatial transcriptome.	human		5	20	cell2location:2;SAW:1;Scanpy:1;CellPhoneDB:1;pySCENIC:1;Squidpy:1	cell_type_mapping:6;cell_cell_interaction:5;spatial_communication:5;spatial_grn_regulon:4;spatial_domain:3;publication_plotting:2;quality_control_preprocessing:1;spatial_cell_type_interpretation:1;spatial_programs:1	paper_digests/papers/S0177.md
177	S0178	10.3389/fcell.2022.878346	2022	Front Cell Dev Biol	A Cellular Resolution Spatial Transcriptomic Landscape of the Medial Structures in Postnatal Mouse Brain.	mouse	brain	3	23	SAW:1;Seurat:1;Scanpy:1;pySCENIC:1;Squidpy:1	spatial_domain:7;publication_plotting:7;quality_control_preprocessing:5;cell_type_mapping:3;spatial_cell_type_interpretation:2;spatial_grn_regulon:2;spatial_programs:1	paper_digests/papers/S0178.md
178	S0179	10.3389/fcell.2023.1112062	2023	Front Cell Dev Biol	Developmental deficits of MGE-derived interneurons in the Cntnap2 knockout mouse model of autism spectrum disorder.	mouse		5	50	SAW:1;Stereopy:1;Seurat:1;Scanpy:1	spatial_domain:10;spatial_programs:3;quality_control_preprocessing:1;spatial_cell_type_interpretation:1;publication_plotting:1;cell_cell_interaction:1;spatial_communication:1;3d_reconstruction:1	paper_digests/papers/S0179.md
179	S0180	10.3389/fgene.2022.858808	2022	Front Genet	Spatial Transcriptome Uncovers the Mouse Lung Architectures and Functions.	mouse	lung	3	10	RCTD/spacexr:1;pySCENIC:1	spatial_domain:5;cell_type_mapping:4;quality_control_preprocessing:3;spatial_grn_regulon:2;spatial_cell_type_interpretation:1	paper_digests/papers/S0180.md
180	S0181	10.3389/fimmu.2024.1522582	2024	Front Immunol	Spatially-resolved analyses of muscle invasive bladder cancer microenvironment unveil a distinct fibroblast cluster associated with prognosis.		cancer	7	36	Seurat:1;CellPhoneDB:1;GSVA:1;GSEA:1	spatial_domain:20;publication_plotting:4;spatial_programs:4;spatial_cell_type_interpretation:3;cell_cell_interaction:2;spatial_communication:2;quality_control_preprocessing:1;spatial_grn_regulon:1	paper_digests/papers/S0181.md
181	S0182	10.3389/fnins.2023.1170355	2023	Front Neurosci	Single-cell chromatin accessibility profiling of cell-state-specific gene regulatory programs during mouse organogenesis.	mouse		4	32	Tangram:2;Seurat:1;Giotto:1	publication_plotting:15;cell_type_mapping:13;developmental_trajectory:11;spatial_domain:7;spatial_programs:6;spatial_cell_type_interpretation:2;spatial_grn_regulon:1;quality_control_preprocessing:1	paper_digests/papers/S0182.md
182	S0183	10.3390/cancers16050846	2024	Cancers (Basel)	Molecular, Metabolic, and Subcellular Mapping of the Tumor Immune Microenvironment via 3D Targeted and Non-Targeted Multiplex Multi-Omics Analyses.		tumor	5	9	Stereopy:1;Scanpy:1;AnnData:1;Harmony:1	spatial_cell_type_interpretation:6;spatial_domain:4;3d_reconstruction:3;quality_control_preprocessing:3;spatial_programs:2;publication_plotting:1	paper_digests/papers/S0183.md
183	S0184	10.4240/wjgs.v17.i4.103494	2025	World J Gastrointest Surg	Single-nucleus RNA sequencing and spatial transcriptomics reveal the mechanism by which Xiaozhiling injection treats internal hemorrhoids.			8	43	Seurat:1	cell_cell_interaction:10;spatial_communication:10;publication_plotting:5;spatial_domain:5;spatial_programs:3;spatial_cell_type_interpretation:3;cell_type_mapping:2	paper_digests/papers/S0184.md
184	S0185	10.46471/gigabyte.110	2024	GigaByte	Generating single-cell gene expression profiles for high-resolution spatial transcriptomics based on cell boundary images.			6	6	Stereopy:1	quality_control_preprocessing:5;3d_reconstruction:3;publication_plotting:1;spatial_domain:1	paper_digests/papers/S0185.md
185	S0186	10.46471/gigabyte.111	2024	GigaByte	SAW: an efficient and accurate data analysis workflow for Stereo-seq spatial transcriptomics.			7	7	SAW:3	quality_control_preprocessing:2;3d_reconstruction:1;spatial_domain:1	paper_digests/papers/S0186.md
186	S0187	10.7554/elife.85873	2023	Elife	Single-cell RNA sequencing reveals cellular and molecular heterogeneity in fibrocartilaginous enthesis formation.			10	11	CellChat:2;Seurat:1;Scanpy:1;AnnData:1;cell2location:1;CellPhoneDB:1;scVelo:1;pySCENIC:1	publication_plotting:9;spatial_domain:8;spatial_programs:4;developmental_trajectory:4;cell_cell_interaction:2;spatial_communication:2;quality_control_preprocessing:1;cell_type_mapping:1;spatial_cell_type_interpretation:1;spatial_grn_regulon:1	paper_digests/papers/S0187.md
187	S0188	10.1101/2022.10.12.511928	2022		FIST-nD: A tool forn-dimensional spatial transcriptomics data imputation via graph-regularized tensor completion			0	0			paper_digests/papers/S0188.md
188	S0189	10.1101/2022.11.04.515095	2022		Integrated transcriptome and lineage analyses reveal novel catecholaminergic cardiomyocytes contributing to the cardiac conduction system in murine heart	mouse	heart	0	0			paper_digests/papers/S0189.md
189	S0190	10.1101/2022.11.09.515447	2022		PAST: latent feature extraction with a Prior-based self-Attention framework for Spatial Transcriptomics			0	0			paper_digests/papers/S0190.md
190	S0191	10.1101/2022.11.16.516728	2022		Efficient reliability analysis of spatially resolved transcriptomics at varying resolutions using SpaSEG			0	0			paper_digests/papers/S0191.md
191	S0192	10.1101/2022.12.07.519417	2022		Spateo: multidimensional spatiotemporal modeling of single-cell spatial transcriptomics			0	0	spateo:1		paper_digests/papers/S0192.md
192	S0193	10.1101/2022.12.08.519589	2022		STOmics-GenX: CRISPR based approach to improve cell identity specific gene detection from spatially resolved transcriptomics			0	0			paper_digests/papers/S0193.md
193	S0194	10.1101/2022.12.31.522366	2022		StereoSiTE: A framework to spatially and quantitatively profile the cellular neighborhood organized iTME			0	0			paper_digests/papers/S0194.md
194	S0195	10.1101/2023.01.08.523162	2023		PASTE2: Partial Alignment of Multi-slice Spatially Resolved Transcriptomics Data			0	0			paper_digests/papers/S0195.md
195	S0196	10.1101/2023.02.02.526814	2023		Construction of a 3D whole organism spatial atlas by joint modeling of multiple slices			0	0			paper_digests/papers/S0196.md
196	S0197	10.1101/2023.02.28.530414	2023		CellBin: a highly accurate single-cell gene expression processing pipeline for high-resolution spatial transcriptomics			0	0			paper_digests/papers/S0197.md
197	S0198	10.1101/2023.04.22.537909	2023		Spatiotemporal transcriptome atlas of human embryos after gastrulation	human	embryo	0	0			paper_digests/papers/S0198.md
198	S0199	10.1101/2023.04.28.538364	2023		Integrated Spatial Transcriptomic and Proteomic Analysis of Fresh Frozen Tissue Based on Stereo-seq			0	0			paper_digests/papers/S0199.md
199	S0200	10.1101/2023.05.03.539335	2023		Spatially-resolved single-cell atlas of ascidian endostyle provides insights into the origin of vertebrate pharyngeal organs	ascidian		0	0			paper_digests/papers/S0200.md
200	S0201	10.1101/2023.05.07.539389	2023		Integrative mapping of spatial transcriptomic and amyloid pathology in Alzheimer’s disease at single-cell resolution			0	0			paper_digests/papers/S0201.md
201	S0202	10.1101/2023.05.11.540374	2023		Mapping cells through time and space with moscot			0	0			paper_digests/papers/S0202.md
202	S0203	10.1101/2023.06.26.546618	2023		Dendrimeric DNA Coordinate Barcoding Design for Spatial RNA Sequencing			0	0			paper_digests/papers/S0203.md
203	S0204	10.1101/2023.07.11.548486	2023		FAST: a fast and scalable factor analysis for spatially aware dimension reduction of multi-section spatial transcriptomics data			0	0			paper_digests/papers/S0204.md
204	S0205	10.1101/2023.10.12.562026	2023		CellContrast: Reconstructing Spatial Relationships in Single-Cell RNA Sequencing Data via Deep Contrastive Learning			0	0			paper_digests/papers/S0205.md
205	S0206	10.1101/2023.10.26.564185	2023		Cell segmentation and gene imputation for imaging-based spatial transcriptomics			0	0			paper_digests/papers/S0206.md
206	S0207	10.1101/2023.11.04.565621	2023		FICTURE:Scalable segmentation-free analysis of submicron resolution spatial transcriptomics			0	0			paper_digests/papers/S0207.md
207	S0208	10.1101/2023.11.21.568179	2023		BARtab & bartools: an integrated Nextflow pipeline and R package for the analysis of synthetic cellular barcodes in the genome and transcriptome			0	0			paper_digests/papers/S0208.md
208	S0209	10.1101/2023.11.26.568752	2023		Giotto Suite: a multi-scale and technology-agnostic spatial multi-omics analysis ecosystem			0	0	Giotto:1		paper_digests/papers/S0209.md
209	S0210	10.1101/2023.12.03.569501	2023		Spatially resolved molecular and cellular atlas of the mouse brain	mouse	brain	0	0			paper_digests/papers/S0210.md
210	S0211	10.1101/2023.12.09.570320	2023		ST-GEARS: Advancing 3D Downstream Research through Accurate Spatial Information Recovery			0	0			paper_digests/papers/S0211.md
211	S0212	10.1101/2023.12.10.571025	2023		stGCL: A versatile cross-modality fusion method based on multi-modal graph contrastive learning for spatial transcriptomics			0	0			paper_digests/papers/S0212.md
212	S0213	10.1101/2023.12.18.572279	2023		STAIG: Spatial Transcriptomics Analysis via Image-Aided Graph Contrastive Learning for Domain Exploration and Alignment-Free Integration			0	0			paper_digests/papers/S0213.md
213	S0214	10.1101/2024.02.06.577903	2024		A single-cell 3D spatiotemporal multi-omics atlas fromDrosophilaembryogenesis to metamorphosis	drosophila	embryo	0	0			paper_digests/papers/S0214.md
214	S0215	10.1101/2024.02.12.579941	2024		Mapping Cell Fate Transition in Space and Time			0	0			paper_digests/papers/S0215.md
215	S0216	10.1101/2024.02.21.581387	2024		MaskGraphene: an advanced framework for interpretable joint representation for multi-slice, multi-condition spatial transcriptomics			0	0			paper_digests/papers/S0216.md
216	S0217	10.1101/2024.02.22.581576	2024		Nova-ST: Nano-Patterned Ultra-Dense platform for spatial transcriptomics			0	0			paper_digests/papers/S0217.md
217	S0218	10.1101/2024.03.08.584153	2024		CytoSignal Detects Locations and Dynamics of Ligand-Receptor Signaling at Cellular Resolution from Spatial Transcriptomic Data			0	0			paper_digests/papers/S0218.md
218	S0219	10.1101/2024.04.17.589795	2024		Enhancer-driven cell type comparison reveals similarities between the mammalian and bird pallium	avian		0	0			paper_digests/papers/S0219.md
219	S0220	10.1101/2024.05.03.592322	2024		Tri-omic mapping revealed concerted dynamics of 3D epigenome and transcriptome in brain cells		brain	0	0			paper_digests/papers/S0220.md
220	S0222	10.1101/2024.05.09.593192	2024		Spatial domains identification in spatial transcriptomics by domain knowledge-aware and subspace-enhanced graph contrastive learning			0	0			paper_digests/papers/S0222.md
221	S0223	10.1101/2024.05.14.594173	2024		Amyloid Beta Glycation Induces Neuronal Mitochondrial Dysfunction and Alzheimer’s Pathogenesis via VDAC1-Dependent mtDNA Efflux			0	0			paper_digests/papers/S0223.md
222	S0224	10.1101/2024.05.21.24306783	2024		Spatial Dissection of the Distinct Cellular Responses to Normal Aging and Alzheimer’s Disease in Human Prefrontal Cortex at Single-Nucleus Resolution	human	cortex	0	0			paper_digests/papers/S0224.md
223	S0225	10.1101/2024.05.21.595103	2024		SCIITensor: A tensor decomposition based algorithm to construct actionable TME modules with spatially resolved intercellular communications			0	0			paper_digests/papers/S0225.md
224	S0226	10.1101/2024.05.27.594872	2024		Towards a universal spatial molecular atlas of the mouse brain	mouse	brain	0	0			paper_digests/papers/S0226.md
225	S0227	10.1101/2024.05.28.596242	2024		Spatiotemporally resolved transcriptome atlas of developing mouse placenta reveals mechanisms of embryonic lethality	mouse	placenta;embryo	0	0			paper_digests/papers/S0227.md
226	S0228	10.1101/2024.05.28.596350	2024		Precise cell recovery by cell nucleus united transcript (CellCUT) for enhanced spatial transcriptomics			0	0			paper_digests/papers/S0228.md
227	S0229	10.1101/2024.06.02.596937	2024		stVCR: Spatiotemporal dynamics of single cells			0	0			paper_digests/papers/S0229.md
228	S0230	10.1101/2024.06.12.598759	2024		Inferring metabolite states from spatial transcriptomes using multiple graph neural network			0	0			paper_digests/papers/S0230.md
229	S0231	10.1101/2024.07.01.601472	2024		Unravelling the progression of the zebrafish primary body axis with reconstructed spatiotemporal transcriptomics	zebrafish		0	0			paper_digests/papers/S0231.md
230	S0232	10.1101/2024.07.04.602147	2024		Benchmarking algorithms for spatially variable gene identification in spatial transcriptomics			0	0			paper_digests/papers/S0232.md
231	S0233	10.1101/2024.09.12.612666	2024		Interpretable high-resolution dimension reduction of spatial transcriptomics data by SpaHDmap			0	0			paper_digests/papers/S0233.md
232	S0234	10.1101/2024.09.23.614515	2024		ELLA: Modeling Subcellular Spatial Variation of Gene Expression within Cells in High-Resolution Spatial Transcriptomics			0	0			paper_digests/papers/S0234.md
233	S0235	10.1101/2024.09.30.615737	2024		Change in brain molecular landscapes following electrical stimulation of the nucleus accumbens		brain	0	0			paper_digests/papers/S0235.md
234	S0236	10.1101/2024.10.15.618405	2024		Benchmarking alternative polyadenylation detection in single-cell and spatial transcriptomes			0	0			paper_digests/papers/S0236.md
235	S0237	10.1101/2024.11.07.622434	2024		Integrative cell bin segmentation on spatial transcriptomics by Voronoi			0	0			paper_digests/papers/S0237.md
236	S0238	10.1101/2024.11.07.622523	2024		Integration of Imaging-based and Sequencing-based Spatial Omics Mapping on the Same Tissue Section via DBiTplus			0	0			paper_digests/papers/S0238.md
237	S0239	10.1101/2024.11.15.623687	2024		Unbiased profiling of multipotency landscapes reveals spatial modulators of clonal fate biases			0	0			paper_digests/papers/S0239.md
238	S0240	10.1101/2024.12.17.628533	2024		Hierarchical Interpretation of Out-of-Distribution Cells Using Bottlenecked Transformer			0	0			paper_digests/papers/S0240.md
239	S0241	10.1101/2024.12.20.629785	2024		Randomized Spatial PCA (RASP): a computationally efficient method for dimensionality reduction of high-resolution spatial transcriptomics data			0	0			paper_digests/papers/S0241.md
240	S0242	10.1101/2025.01.15.633111	2025		Sequencing-based Spatial Transcriptomics with scRNA-seq Sensitivity			0	0			paper_digests/papers/S0242.md
241	S0243	10.1101/2025.01.16.630222	2025		Single cell resolved spatial immune repertoire unveils spatial heterogeneity of lymphoid aggregates in human immune disorders	human		0	0			paper_digests/papers/S0243.md
242	S0244	10.1101/2025.01.21.633854	2025		Single-cell spatial transcriptome reveals pathological features of human hippocampus with sclerosis	human		0	0			paper_digests/papers/S0244.md
243	S0245	10.1101/2025.01.24.634655	2025		ST-FFPE-mIF: Integrating Spatial Transcriptomics and Multiplex Immunofluorescence in Formalin-Fixed Paraffin-Embedded Tissues Using Stereo-seq			0	0			paper_digests/papers/S0245.md
244	S0246	10.1101/2025.01.27.635178	2025		Zmap: an intelligent region-allocation method to map single-cell into spatial data			0	0			paper_digests/papers/S0246.md
245	S0247	10.1101/2025.02.05.636735	2025		Φ-Space ST: a platform-agnostic method to identify cell states in spatial transcriptomics studies			0	0			paper_digests/papers/S0247.md
246	S0248	10.1101/2025.02.14.638351	2025		Learning Latent Trajectories in Developmental Time Series with Hidden-Markov Optimal Transport			0	0			paper_digests/papers/S0248.md
247	S0249	10.1101/2025.02.26.640406	2025		Smoothie: Efficient Inference of Spatial Co-expression Networks from Denoised Spatial Transcriptomics Data			0	0			paper_digests/papers/S0249.md
248	S0250	10.1101/2025.03.06.637776	2025		Spatial transcriptomics elucidates the central role of cerebral vasculatures in the progression of Japanese encephalitis			0	0			paper_digests/papers/S0250.md
249	S0251	10.1101/2025.03.13.642300	2025		DisConST: Deciphering Spatial Domains Using Distribution-aware Contrastive Learning for Spatial Transcriptomics			0	0			paper_digests/papers/S0251.md
250	S0252	10.1101/2025.03.15.643484	2025		Single-cell Spatial Transcriptomics Reveals Disease-specific Microenvironmental Niches in Neurodegeneration and COVID-19			0	0			paper_digests/papers/S0252.md
251	S0253	10.1101/2025.04.05.647412	2025		Spatial Metagene Discovery and Associated Molecular Pattern Characterization in Spatial Transcriptomics and Multi-Omics using SEPAR			0	0			paper_digests/papers/S0253.md
252	S0254	10.1101/2025.04.07.647590	2025		SpatioCell: Deep Integration of Histology and Spatial Transcriptomics for Profiling the Cellular Microenvironment at Single-Cell Level			0	0			paper_digests/papers/S0254.md
253	S0255	10.1101/2025.04.15.648894	2025		Topography Aware Optimal Transport for Alignment of Spatial Omics Data			0	0			paper_digests/papers/S0255.md
254	S0256	10.1101/2025.04.16.649254	2025		stPipe:A flexible and streamlined R/Bioconductor pipeline for preprocessing sequencing-based spatial transcriptomics data			0	0			paper_digests/papers/S0256.md
255	S0257	10.1101/2025.05.01.651634	2025		Separable Spatial Single-cell Transcriptome Representation Learning via Graph Transformer and Hyperspherical Prototype Clustering			0	0			paper_digests/papers/S0257.md
256	S0258	10.1101/2025.05.04.651803	2025		Application of spatial transcriptomics across organoids: a high-resolution spatial whole-transcriptome benchmarking dataset			0	0			paper_digests/papers/S0258.md
257	S0259	10.1101/2025.05.11.652625	2025		Spatial geometry-aware deep learning for deciphering tissue structure from spatially resolved transcriptomics			0	0			paper_digests/papers/S0259.md
258	S0260	10.1101/2025.05.11.653070	2025		A Multimodal Graph Learning Framework for Versatile Spatial Transcriptomics Analysis with SpatialModal			0	0			paper_digests/papers/S0260.md
259	S0261	10.1101/2025.05.27.656326	2025		Spatial metabolomics reveals persistent localized niche-specific metabolic failure in kidneys following ischemia-reperfusion injury		kidney	0	0			paper_digests/papers/S0261.md
260	S0262	10.1101/2025.05.30.654767	2025		Structural innovations and neurogenic continuity define avian brain development and evolution	avian	brain	0	0			paper_digests/papers/S0262.md
261	S0263	10.1101/2025.06.08.658529	2025		Spatial transcriptomics of developing wheat seed reveals radial expression patterns in endosperm and subgenome biased expression of key genes			0	0			paper_digests/papers/S0263.md
262	S0264	10.1101/2025.07.17.665323	2025		A single-cell transcriptomic atlas maps cerebellar astrocyte diversity and uncovers the transcriptional code underlying their maturation trajectories			0	0			paper_digests/papers/S0264.md
263	S0265	10.1101/2025.08.02.668292	2025		spOT-NMF: Optimal Transport-Based Matrix Factorization for Accurate Deconvolution of Spatial Transcriptomics			0	0			paper_digests/papers/S0265.md
264	S0266	10.1101/2025.08.15.670472	2025		Three-dimensional spatial transcriptomics at isotropic resolution enabled by generative deep learning			0	0			paper_digests/papers/S0266.md
265	S0267	10.1101/2025.08.30.673245	2025		STADiffuser: high-fidelity simulation and full-view 3D modeling of spatial transcriptomics			0	0			paper_digests/papers/S0267.md
266	S0268	10.1101/2025.09.02.673732	2025		Uncovering directionally and temporally variable genes with STAVAG			0	0			paper_digests/papers/S0268.md
267	S0269	10.1101/2025.09.07.674688	2025		Subcellular mRNA localization patterns across tissues resolved with spatial transcriptomics			0	0			paper_digests/papers/S0269.md
268	S0270	10.1101/2025.09.12.675967	2025		Decoder-FFPE-seq enables sensitive, genome-wide spatial transcriptomics of archival tissues at single-cell resolution			0	0			paper_digests/papers/S0270.md
269	S0271	10.1101/2025.09.14.676067	2025		SpatialFuser: A Unified Deep Learning Framework for Spatial Multi-Omics Data Integrative Analysis			0	0			paper_digests/papers/S0271.md
270	S0272	10.1101/2025.09.16.676466	2025		jsPCA: fast, scalable, and interpretable identification of spatial domains and variable genes across multi-slice and multi-sample spatial transcriptomics data			0	0			paper_digests/papers/S0272.md
271	S0273	10.1101/2025.09.24.678397	2025		Mapping disease critical spatially variable gene programs by integrating spatial transcriptomics with human genetics	human		0	0			paper_digests/papers/S0273.md
272	S0274	10.1101/2025.10.01.679918	2025		SpacGPA: annotating spatial transcriptomes through de novo interpretable gene programs			0	0			paper_digests/papers/S0274.md
273	S0275	10.1101/2025.10.03.680397	2025		Comparative transcriptomics reveals differences in cortical cell type organization between metatherian and eutherian mammals			0	0			paper_digests/papers/S0275.md
274	S0276	10.1101/2025.10.06.680672	2025		Optimal transport modeling uncovers spatial domain dynamics in spatiotemporal transcriptomics studies			0	0			paper_digests/papers/S0276.md
275	S0277	10.1101/2025.10.13.681959	2025		A Population-scale Single-cell Spatial Transcriptomic Atlas of the Human Cortex	human	cortex	0	0			paper_digests/papers/S0277.md
276	S0278	10.1101/2025.10.23.683357	2025		CellBin:a generalist framework to process spatial omics data to cell level			0	0			paper_digests/papers/S0278.md
277	S0279	10.21203/rs.3.rs-3714208/v1	2023		Identification and characterization of human retinal stem cells capable of retinal regeneration	human		0	0			paper_digests/papers/S0279.md
278	S0280	10.21203/rs.3.rs-3939678/v1	2024		Spatial Transcriptomic Alignment, Integration, and de novo 3D Reconstruction by STAIR			0	0			paper_digests/papers/S0280.md
