selection_rank	paper_id	doi	year	journal	title	species	tissue	figure_count	panel_count	tools_observed	skill_tags	digest_path
1	S0001	10.1002/advs.202203040	2022	Adv Sci (Weinh)	Single-Nucleus RNA Sequencing and Spatial Transcriptomics Reveal the Immunological Microenvironment of Cervical Squamous Cell Carcinoma.		carcinoma	7	7	GSVA:3;Seurat:1;CellChat:1;Monocle:1;GSEA:1	publication_plotting:6;spatial_programs:5;cell_type_mapping:3;spatial_cell_type_interpretation:2;spatial_domain:2;developmental_trajectory:1;quality_control_preprocessing:1;cell_cell_interaction:1;spatial_communication:1	paper_digests/papers/S0001.md
2	S0002	10.1002/advs.202405914	2025	Adv Sci (Weinh)	Spatiotemporal Transcriptomic Profiling Reveals the Dynamic Immunological Landscape of Alveolar Echinococcosis.			7	9	GSVA:3;CellChat:3;Tangram:2;NicheNet:2;Seurat:1;pySCENIC:1;Harmony:1	spatial_domain:6;cell_type_mapping:5;spatial_programs:5;publication_plotting:5;cell_cell_interaction:4;spatial_communication:4;developmental_trajectory:1;quality_control_preprocessing:1;spatial_cell_type_interpretation:1	paper_digests/papers/S0002.md
3	S0003	10.1002/advs.202407221	2024	Adv Sci (Weinh)	Cross-Species Insights into Trophoblast Invasion During Placentation Governed by Immune-Featured Trophoblast Cells.		placenta;placentation	6	6	cell2location:2;Seurat:1;CellChat:1;Monocle:1	cell_type_mapping:6;spatial_domain:6;publication_plotting:5;spatial_programs:5;spatial_cell_type_interpretation:4;developmental_trajectory:2;cell_cell_interaction:1;spatial_communication:1	paper_digests/papers/S0003.md
4	S0004	10.1002/advs.202411126	2025	Adv Sci (Weinh)	Integrating Spatial and Single-Nucleus Transcriptomic Data to Assess the Effects of Intrauterine Hyperglycemia on Fetal Pancreatic Development.			6	13	CellChat:3;pySCENIC:2;SAW:1;Seurat:1;Scanpy:1;Harmony:1	publication_plotting:5;spatial_programs:5;spatial_domain:4;quality_control_preprocessing:4;spatial_cell_type_interpretation:4;cell_cell_interaction:3;spatial_communication:3;cell_type_mapping:3;spatial_grn_regulon:1	paper_digests/papers/S0004.md
5	S0005	10.1002/advs.202414230	2025	Adv Sci (Weinh)	Human Pituitary Organoids: Transcriptional Landscape Deciphered by scRNA-Seq and Stereo-Seq, with Insights into SOX3's Role in Pituitary Development.	human		7	9	Seurat:1;CellChat:1;Monocle:1	publication_plotting:4;spatial_domain:4;developmental_trajectory:2;spatial_programs:2;3d_reconstruction:1;cell_cell_interaction:1;spatial_communication:1	paper_digests/papers/S0005.md
6	S0006	10.1002/advs.202417528	2025	Adv Sci (Weinh)	Integrative Single-Cell Analysis Reveals Iron Overload-Induced Senescence and Metabolic Reprogramming in Ovarian Endometriosis-Associated Infertility.		ovarian	8	23	Monocle:4;GSEA:3;CellChat:2;RCTD/spacexr:2;SAW:1;Seurat:1;pySCENIC:1;Harmony:1	spatial_programs:10;cell_type_mapping:8;publication_plotting:7;spatial_domain:6;spatial_cell_type_interpretation:3;developmental_trajectory:3;quality_control_preprocessing:1;cell_cell_interaction:1;spatial_communication:1;spatial_grn_regulon:1	paper_digests/papers/S0006.md
7	S0007	10.1002/advs.202500216	2025	Adv Sci (Weinh)	Single-Cell and Spatial Transcriptomic Profiling of Penile Squamous Cell Carcinoma Reveals Dynamics of Tumor Differentiation and Immune Microenvironment.		tumor;carcinoma	6	10	pySCENIC:2;SAW:1;Stereopy:1;Seurat:1;Scanpy:1;AnnData:1;CellChat:1;NicheNet:1;Squidpy:1	publication_plotting:7;spatial_domain:5;cell_type_mapping:4;developmental_trajectory:4;spatial_programs:4;cell_cell_interaction:3;spatial_communication:3;spatial_cell_type_interpretation:2;spatial_grn_regulon:1;quality_control_preprocessing:1	paper_digests/papers/S0007.md
8	S0008	10.1002/advs.202509733	2025	Adv Sci (Weinh)	Globotriaosylceramide Gb3 Influences Wound Healing and Scar Formation by Orchestrating Fibroblast Heterogeneity.			7	8	GSVA:2;SAW:1;Seurat:1;Scanpy:1	spatial_programs:5;spatial_domain:3;developmental_trajectory:2;quality_control_preprocessing:2;spatial_cell_type_interpretation:2;cell_type_mapping:1;publication_plotting:1;cell_cell_interaction:1;spatial_communication:1	paper_digests/papers/S0008.md
9	S0009	10.1002/ctm2.1515	2023	Clin Transl Med	Single-cell and spatial transcriptomics reveal POSTN+ cancer-associated fibroblasts correlated with immune suppression and tumour progression in non-small cell lung cancer.		lung;cancer	5	34	SAW:1;Seurat:1;RCTD/spacexr:1;SPOTlight:1;NicheNet:1;GSVA:1;GSEA:1	publication_plotting:10;spatial_domain:9;spatial_programs:3;spatial_cell_type_interpretation:3;quality_control_preprocessing:3;cell_type_mapping:2;cell_cell_interaction:2;spatial_communication:2;developmental_trajectory:1	paper_digests/papers/S0009.md
10	S0010	10.1002/ctm2.669	2022	Clin Transl Med	Clinical challenges of tissue preparation for spatial transcriptome.			6	95	Seurat:1;SingleR:1	quality_control_preprocessing:4;spatial_domain:2;developmental_trajectory:1;cell_type_mapping:1;publication_plotting:1	paper_digests/papers/S0010.md
11	S0011	10.1002/imt2.272	2025	Imeta	Cross-tissue multi-omics analyses reveal the gut microbiota's absence impacts organ morphology, immune homeostasis, bile acid and lipid metabolism.			6	46	SAW:1;Seurat:1;cell2location:1	publication_plotting:17;spatial_programs:11;spatial_domain:9;spatial_cell_type_interpretation:2;cell_type_mapping:2;quality_control_preprocessing:2;3d_reconstruction:1;developmental_trajectory:1;cell_cell_interaction:1;spatial_communication:1	paper_digests/papers/S0011.md
12	S0012	10.1007/s11427-023-2360-3	2024	Sci China Life Sci	Cellular atlases of ovarian microenvironment alterations by diet and genetically-induced obesity.		ovarian	0	0			paper_digests/papers/S0012.md
13	S0013	10.1007/s11427-023-2467-1	2024	Sci China Life Sci	The spatial transcriptomic landscape of human gingiva in health and periodontitis.	human	gingiva	0	0			paper_digests/papers/S0013.md
14	S0014	10.1007/s12264-024-01241-y	2025	Neurosci Bull	Dentate Gyrus Morphogenesis is Regulated by an Autism Risk Gene Trio Function in Granule Cells.			7	25	GSEA:2;Seurat:1	spatial_domain:2;cell_type_mapping:1;publication_plotting:1;quality_control_preprocessing:1;spatial_programs:1;cell_cell_interaction:1;spatial_communication:1	paper_digests/papers/S0014.md
15	S0016	10.1016/j.ard.2025.04.025	2025	Ann Rheum Dis	Spatial multiomics decipher fibroblast-macrophage dynamics in systemic sclerosis.			0	0			paper_digests/papers/S0016.md
16	S0017	10.1016/j.bbrep.2025.102087	2025	Biochem Biophys Rep	Single-cell spatial transcriptomics reveals pathogenic mechanism of renal fibrosis in imiquimod-induced lupus nephritis in mice.	mouse		6	25	SAW:1;Seurat:1;RCTD/spacexr:1;NicheNet:1;pySCENIC:1	spatial_domain:13;spatial_programs:6;publication_plotting:5;spatial_cell_type_interpretation:4;cell_type_mapping:2;cell_cell_interaction:2;spatial_communication:2;quality_control_preprocessing:1	paper_digests/papers/S0017.md
17	S0018	10.1016/j.canlet.2024.217327	2025	Cancer Lett	Local ablation disrupts immune evasion in pancreatic cancer.		cancer	0	0			paper_digests/papers/S0018.md
18	S0019	10.1016/j.ccell.2024.07.006	2024	Cancer Cell	CCL19-producing fibroblasts promote tertiary lymphoid structure formation enhancing anti-tumor IgG response in colorectal cancer liver metastasis.		liver;tumor;cancer	0	0			paper_digests/papers/S0019.md
19	S0020	10.1016/j.ccell.2025.03.011	2025	Cancer Cell	Spatial transcriptomics reveals tryptophan metabolism restricting maturation of intratumoral tertiary lymphoid structures.		tumor	0	0			paper_digests/papers/S0020.md
20	S0021	10.1016/j.cell.2022.04.003	2022	Cell	Spatiotemporal transcriptomic atlas of mouse organogenesis using DNA nanoball-patterned arrays.	mouse		0	0			paper_digests/papers/S0021.md
21	S0022	10.1016/j.cell.2023.06.009	2023	Cell	Single-cell spatial transcriptome reveals cell-type organization in the macaque cortex.	macaque	cortex	0	0			paper_digests/papers/S0022.md
22	S0023	10.1016/j.cell.2023.08.020	2023	Cell	Spatiotemporal insight into early pregnancy governed by immune-featured stromal cells.			0	0			paper_digests/papers/S0023.md
23	S0024	10.1016/j.cell.2023.11.016	2023	Cell	Spatiotemporal transcriptome atlas reveals the regional specification of the developing human brain.	human	brain	0	0			paper_digests/papers/S0024.md
24	S0025	10.1016/j.cell.2024.03.041	2024	Cell	3D reconstruction of a gastrulating human embryo.	human	embryo	0	0			paper_digests/papers/S0025.md
25	S0026	10.1016/j.cell.2024.10.011	2024	Cell	Spatiotemporal modeling of molecular holograms.			0	0			paper_digests/papers/S0026.md
26	S0027	10.1016/j.cell.2024.10.019	2024	Cell	Spatial transcriptomic landscape unveils immunoglobin-associated senescence as a hallmark of aging.			0	0			paper_digests/papers/S0027.md
27	S0028	10.1016/j.cell.2025.02.037	2025	Cell	Single-cell spatial transcriptome atlas and whole-brain connectivity of the macaque claustrum.	macaque	brain	0	0			paper_digests/papers/S0028.md
28	S0029	10.1016/j.cell.2025.03.024	2025	Cell	An Arabidopsis single-nucleus atlas decodes leaf senescence and nutrient allocation.	arabidopsis	leaf	0	0			paper_digests/papers/S0029.md
29	S0030	10.1016/j.cell.2025.05.035	2025	Cell	Digital reconstruction of full embryos during early mouse organogenesis.	mouse	embryo	0	0			paper_digests/papers/S0030.md
30	S0031	10.1016/j.cell.2025.05.047	2025	Cell	A Drosophila single-cell 3D spatiotemporal multi-omics atlas unveils panoramic key regulators of cell-type differentiation.	drosophila		0	0			paper_digests/papers/S0031.md
31	S0032	10.1016/j.celrep.2024.113784	2024	Cell Rep	Single-cell spatial transcriptomic and translatomic profiling of dopaminergic neurons in health, aging, and disease.			0	0			paper_digests/papers/S0032.md
32	S0033	10.1016/j.celrep.2024.114216	2024	Cell Rep	Microglia-astrocyte crosstalk in the amyloid plaque niche of an Alzheimer's disease mouse model, as revealed by spatial transcriptomics.	mouse		0	0			paper_digests/papers/S0033.md
33	S0034	10.1016/j.celrep.2025.115240	2025	Cell Rep	A single-cell and spatial wheat root atlas with cross-species annotations delineates conserved tissue-specific marker genes and regulators.		root	6	19	SAW:1;Seurat:1;AnnData:1;Squidpy:1;Harmony:1	publication_plotting:3;spatial_domain:3;cell_type_mapping:3;spatial_grn_regulon:1	paper_digests/papers/S0034.md
34	S0035	10.1016/j.cels.2024.09.005	2024	Cell Syst	SpotGF: Denoising spatially resolved transcriptomics data using an optimal transport-based gene filtering algorithm.			0	0			paper_digests/papers/S0035.md
35	S0036	10.1016/j.cels.2025.101194	2025	Cell Syst	Inferring cell trajectories of spatial transcriptomics via optimal transport analysis.			0	0			paper_digests/papers/S0036.md
36	S0037	10.1016/j.cels.2025.101243	2025	Cell Syst	SpaGRN: Investigating spatially informed regulatory paths for spatially resolved transcriptomics data.			0	0	SpaGRN:1		paper_digests/papers/S0037.md
37	S0038	10.1016/j.cmet.2024.01.003	2024	Cell Metab	Region-specific transcriptomic responses to obesity and diabetes in macaque hypothalamus.	macaque	hypothalamus	0	0			paper_digests/papers/S0038.md
38	S0039	10.1016/j.crmeth.2024.100763	2024	Cell Rep Methods	Analysis of synthetic cellular barcodes in the genome and transcriptome with BARtab and bartools.			6	24	Seurat:2;SAW:1;Stereopy:1;Scanpy:1	spatial_domain:8;publication_plotting:8;quality_control_preprocessing:7;developmental_trajectory:5;3d_reconstruction:1;spatial_cell_type_interpretation:1;spatial_programs:1	paper_digests/papers/S0039.md
39	S0040	10.1016/j.crmeth.2025.101205	2025	Cell Rep Methods	stTransfer enables transfer of single-cell annotations to spatial transcriptomics with single-cell resolution.			7	25	SAW:1;Seurat:1;Scanpy:1;AnnData:1;RCTD/spacexr:1;cell2location:1;Tangram:1;SingleR:1;spateo:1;SpaGCN:1	cell_type_mapping:14;publication_plotting:7;spatial_domain:4;quality_control_preprocessing:3;3d_reconstruction:1;spatial_programs:1	paper_digests/papers/S0040.md
40	S0041	10.1016/j.csbj.2023.06.020	2023	Comput Struct Biotechnol J	Single-cell and spatiotemporal transcriptomic analyses reveal the effects of microorganisms on immunity and metabolism in the mouse liver.	mouse	liver	5	19	Seurat:2;SPOTlight:1;CellChat:1;pySCENIC:1	spatial_domain:8;spatial_programs:5;cell_type_mapping:3;publication_plotting:3;quality_control_preprocessing:2;spatial_cell_type_interpretation:1	paper_digests/papers/S0041.md
41	S0042	10.1016/j.devcel.2022.04.006	2022	Dev Cell	High-resolution 3D spatiotemporal transcriptomic maps of developing Drosophila embryos and larvae.	drosophila	embryo	0	0			paper_digests/papers/S0042.md
42	S0043	10.1016/j.devcel.2022.04.009	2022	Dev Cell	Spatiotemporal mapping of gene expression landscapes and developmental trajectories during zebrafish embryogenesis.	zebrafish	embryo	0	0			paper_digests/papers/S0043.md
43	S0044	10.1016/j.devcel.2022.04.011	2022	Dev Cell	The single-cell stereo-seq reveals region-specific cell subtypes and transcriptome profiling in Arabidopsis leaves.	arabidopsis		0	0			paper_digests/papers/S0044.md
44	S0045	10.1016/j.devcel.2024.05.016	2024	Dev Cell	Spatiotemporal transcriptomic landscape of rice embryonic cells during seed germination.	rice	embryo	0	0			paper_digests/papers/S0045.md
45	S0046	10.1016/j.devcel.2025.03.009	2025	Dev Cell	Transcriptional conservation and evolutionary divergence of cell types across mammalian hypothalamus development.		hypothalamus	0	0			paper_digests/papers/S0046.md
46	S0047	10.1016/j.devcel.2025.04.014	2025	Dev Cell	Genomic evolution reshapes cell-type diversification in the amniote brain.		brain	0	0			paper_digests/papers/S0047.md
47	S0048	10.1016/j.ebiom.2024.105363	2024	EBioMedicine	Chronic lung inflammation and CK14+ basal cell proliferation induce persistent alveolar-bronchiolization in SARS-CoV-2-infected hamsters.		lung	10	46	SAW:1;Seurat:1	spatial_domain:8;spatial_programs:7;developmental_trajectory:1;quality_control_preprocessing:1;spatial_cell_type_interpretation:1	paper_digests/papers/S0048.md
48	S0049	10.1016/j.fmre.2022.01.036	2023	Fundam Res	Spatial transcriptome unveils a discontinuous inflammatory pattern in proficient mismatch repair colorectal adenocarcinoma.		carcinoma	4	17	SPOTlight:2;Seurat:1;GSEA:1;BayesSpace:1	spatial_domain:7;publication_plotting:3;quality_control_preprocessing:2;cell_type_mapping:1;spatial_cell_type_interpretation:1;spatial_programs:1	paper_digests/papers/S0049.md
49	S0050	10.1016/j.fmre.2025.04.014	2025	Fundam Res	Primary cilia in growth plates orchestrate long bone development.			8	39	SAW:1;Seurat:1;CellChat:1	spatial_programs:5;developmental_trajectory:4;spatial_domain:3;publication_plotting:3;spatial_cell_type_interpretation:1;cell_cell_interaction:1;spatial_communication:1;3d_reconstruction:1	paper_digests/papers/S0050.md
50	S0051	10.1016/j.gendis.2024.101304	2025	Genes Dis	Profiling the cell diversity and tissue structure of aqueous humor circulatory system in human eyes using spatial single-cell RNA sequencing.	human		1	9		publication_plotting:4;cell_type_mapping:3;spatial_domain:3;spatial_programs:2;spatial_cell_type_interpretation:1	paper_digests/papers/S0051.md
51	S0052	10.1016/j.heliyon.2023.e22461	2023	Heliyon	Cellular and molecular mechanisms of fibrosis and resolution in bleomycin-induced pulmonary fibrosis mouse model revealed by spatial transcriptome analysis.	mouse		6	6	SAW:1;Seurat:1;CellChat:1;GSEA:1	cell_type_mapping:4;developmental_trajectory:4;publication_plotting:3;spatial_programs:3;cell_cell_interaction:2;spatial_communication:2;quality_control_preprocessing:1	paper_digests/papers/S0052.md
52	S0053	10.1016/j.isci.2024.108941	2024	iScience	Effects of flora deficiency on the structure and function of the large intestine.		intestine	8	40	Seurat:6;BayesSpace:2;cell2location:1;Tangram:1;CellChat:1	spatial_programs:11;spatial_domain:10;cell_type_mapping:9;quality_control_preprocessing:7;publication_plotting:4;spatial_cell_type_interpretation:3;3d_reconstruction:1	paper_digests/papers/S0053.md
53	S0054	10.1016/j.isci.2024.109009	2024	iScience	Spatial and single-nucleus transcriptomics decoding the molecular landscape and cellular organization of avian optic tectum.	avian		5	28	spateo:2;SAW:1;Seurat:1;Scanpy:1;AnnData:1;SpaGCN:1	spatial_domain:16;publication_plotting:9;spatial_programs:6;quality_control_preprocessing:3;cell_type_mapping:3;spatial_cell_type_interpretation:2	paper_digests/papers/S0054.md
54	S0055	10.1016/j.isci.2025.112128	2025	iScience	Single-nucleus profiling decoding the subcortical visual pathway evolution of vertebrates.			5	27	SAW:1;Seurat:1;Scanpy:1;AnnData:1	spatial_programs:11;publication_plotting:11;spatial_domain:5;cell_type_mapping:4;spatial_grn_regulon:1	paper_digests/papers/S0055.md
55	S0056	10.1016/j.isci.2025.113626	2025	iScience	Single-cell and spatial transcriptomics reveal intratumor heterogeneity and immune evasion in natural killer/T cell lymphoma.		tumor	6	44	SPOTlight:2;SAW:1;Seurat:1;CellPhoneDB:1;Monocle:1;GSVA:1;GSEA:1	publication_plotting:18;cell_type_mapping:10;spatial_domain:6;developmental_trajectory:5;spatial_programs:2;cell_cell_interaction:1;spatial_communication:1	paper_digests/papers/S0056.md
56	S0057	10.1016/j.jdermsci.2024.11.001	2025	J Dermatol Sci	Unveiling intratumoral heterogeneity in high-risk cutaneous squamous cell carcinoma using single-cell spatial enhanced resolution omics-sequencing (Stereo-seq).		tumor;carcinoma	0	0			paper_digests/papers/S0057.md
57	S0058	10.1016/j.jgg.2023.04.001	2023	J Genet Genomics	VT3D: a visualization toolbox for 3D transcriptomic data.			0	0			paper_digests/papers/S0058.md
58	S0059	10.1016/j.jgg.2023.04.012	2023	J Genet Genomics	Microbiota-mediated shaping of mouse spleen structure and immune function characterized by scRNA-seq and Stereo-seq.	mouse	spleen	0	0			paper_digests/papers/S0059.md
59	S0060	10.1016/j.jgg.2024.04.002	2024	J Genet Genomics	DAIS: a method for identifying spatial domains based on density clustering of spatial omics data.			0	0			paper_digests/papers/S0060.md
60	S0061	10.1016/j.jid.2025.04.041	2026	J Invest Dermatol	High-Resolution Spatial Map of the Human Facial Sebaceous Gland Reveals Marker Genes and Decodes Sebocyte Differentiation.	human		0	0			paper_digests/papers/S0061.md
61	S0062	10.1016/j.jid.2025.08.011	2026	J Invest Dermatol	High-Resolution Spatial Transcriptomics Unveils Spatially Resolved Gene Modules and Fatty Acid Metabolism Dysregulation in Human Skin Aging.	human		0	0			paper_digests/papers/S0062.md
62	S0063	10.1016/j.molp.2025.02.003	2025	Mol Plant	A large-scale integrated transcriptomic atlas for soybean organ development.	soybean		0	0			paper_digests/papers/S0063.md
63	S0064	10.1016/j.molp.2025.04.001	2025	Mol Plant	Comparative spatial transcriptomics reveals root dryland adaptation mechanism in rice and HMGB1 as a key regulator.	rice	root	0	0			paper_digests/papers/S0064.md
64	S0065	10.1016/j.neuron.2025.02.015	2025	Neuron	Single-cell spatial transcriptomic atlas of the whole mouse brain.	mouse	brain	0	0			paper_digests/papers/S0065.md
65	S0066	10.1016/j.neuron.2025.03.002	2025	Neuron	Molecular pathways and diagnosis in spatially resolved Alzheimer's hippocampal atlas.			0	0			paper_digests/papers/S0066.md
66	S0067	10.1016/j.neuron.2025.04.026	2025	Neuron	Spatiotemporal transcriptomic maps of mouse intracerebral hemorrhage at single-cell resolution.	mouse		0	0			paper_digests/papers/S0067.md
67	S0068	10.1016/j.stem.2025.04.007	2025	Cell Stem Cell	3D reconstruction of a human Carnegie stage 9 embryo provides a snapshot of early body plan formation.	human	embryo	0	0			paper_digests/papers/S0068.md
68	S0069	10.1016/j.xcrm.2023.101231	2023	Cell Rep Med	Cancer-associated fibroblasts undergoing neoadjuvant chemotherapy suppress rectal cancer revealed by single-cell and spatial transcriptomics.		cancer	6	40	GSEA:3;SAW:1;Seurat:1;SPOTlight:1;CellChat:1;CellPhoneDB:1;NicheNet:1;Slingshot:1;Harmony:1	spatial_programs:19;publication_plotting:10;spatial_cell_type_interpretation:7;cell_type_mapping:5;cell_cell_interaction:1;spatial_communication:1;quality_control_preprocessing:1;developmental_trajectory:1;spatial_domain:1	paper_digests/papers/S0069.md
69	S0070	10.1016/j.xcrm.2024.101914	2025	Cell Rep Med	High cellular plasticity state of medulloblastoma local recurrence and distant dissemination.			7	69	GSVA:2;GSEA:2;Seurat:1;Scanpy:1	publication_plotting:11;spatial_programs:7;spatial_domain:5;cell_type_mapping:3;cell_cell_interaction:3;spatial_communication:3;spatial_grn_regulon:1	paper_digests/papers/S0070.md
70	S0071	10.1016/j.xcrm.2025.102140	2025	Cell Rep Med	Targeting mitochondrial complex I of CD177+ neutrophils alleviates lung ischemia-reperfusion injury.		lung	6	52	Monocle:2;SAW:1;Stereopy:1;Seurat:1;GSEA:1;Harmony:1	publication_plotting:12;spatial_domain:6;spatial_programs:6;spatial_cell_type_interpretation:5;cell_type_mapping:2;developmental_trajectory:2;quality_control_preprocessing:1;cell_cell_interaction:1	paper_digests/papers/S0071.md
71	S0072	10.1038/s41380-024-02659-6	2025	Mol Psychiatry	Astrocytic Neuroligin-3 influences gene expression and social behavior, but is dispensable for synapse number.			0	0			paper_digests/papers/S0072.md
72	S0073	10.1038/s41392-025-02143-9	2025	Signal Transduct Target Ther	Spatiotemporal transcriptomics elucidates the pathogenesis of fulminant viral myocarditis.		myocarditis	6	14	Seurat:3;SAW:1;cell2location:1;CellChat:1;Monocle:1;Slingshot:1;pySCENIC:1;GSEA:1;Harmony:1	publication_plotting:8;spatial_domain:8;cell_type_mapping:7;spatial_programs:5;cell_cell_interaction:3;spatial_communication:3;developmental_trajectory:2;spatial_grn_regulon:2	paper_digests/papers/S0073.md
73	S0074	10.1038/s41421-024-00656-1	2024	Cell Discov	Single-cell multi-omics analysis of lineage development and spatial organization in the human fetal cerebellum.	human	cerebellum	5	5	SAW:1;Stereopy:1;Seurat:1;Monocle:1;scVelo:1;GSEA:1;Harmony:1	developmental_trajectory:5;publication_plotting:4;spatial_grn_regulon:4;cell_type_mapping:3;spatial_domain:3;spatial_programs:3;cell_cell_interaction:1;spatial_communication:1;spatial_cell_type_interpretation:1	paper_digests/papers/S0074.md
74	S0075	10.1038/s41421-024-00733-5	2024	Cell Discov	Single-cell spatiotemporal analysis reveals alveolar dendritic cell-T cell immunity hubs defending against pulmonary infection.			5	8	AnnData:2;SAW:1;Seurat:1;Scanpy:1;CellChat:1;Harmony:1	spatial_cell_type_interpretation:6;cell_type_mapping:5;spatial_domain:5;publication_plotting:4;cell_cell_interaction:3;spatial_communication:3;spatial_programs:2;developmental_trajectory:1;quality_control_preprocessing:1	paper_digests/papers/S0075.md
75	S0076	10.1038/s41421-024-00734-4	2024	Cell Discov	Single-cell spatiotemporal analysis of the lungs reveals Slamf9+ macrophages involved in viral clearance and inflammation resolution.		lung	5	11	SAW:1;Seurat:1;Scanpy:1;CellChat:1;Monocle:1;scVelo:1;Harmony:1	cell_type_mapping:5;publication_plotting:3;quality_control_preprocessing:3;spatial_programs:3;developmental_trajectory:2;spatial_domain:2;spatial_cell_type_interpretation:1;cell_cell_interaction:1;spatial_communication:1	paper_digests/papers/S0076.md
76	S0077	10.1038/s41421-024-00740-6	2024	Cell Discov	A spatiotemporal transcriptomic atlas of mouse placentation.	mouse	placenta;placentation	6	8	SAW:1;Stereopy:1;Seurat:1;Scanpy:1;cell2location:1;Tangram:1;CellChat:1;CellPhoneDB:1;scVelo:1;dynamo:1;spateo:1;pySCENIC:1	quality_control_preprocessing:6;spatial_domain:6;developmental_trajectory:5;cell_type_mapping:4;spatial_grn_regulon:4;publication_plotting:3;spatial_cell_type_interpretation:3;spatial_programs:3;cell_cell_interaction:2;spatial_communication:2	paper_digests/papers/S0077.md
77	S0078	10.1038/s41421-024-00747-z	2025	Cell Discov	Stromal architecture and fibroblast subpopulations with opposing effects on outcomes in hepatocellular carcinoma.		carcinoma	7	12	GSEA:2;Seurat:1;SPOTlight:1;CellPhoneDB:1;GSVA:1;SpaGCN:1;Harmony:1;OpenCV:1	publication_plotting:8;spatial_programs:6;spatial_domain:5;spatial_cell_type_interpretation:3;quality_control_preprocessing:3;cell_cell_interaction:3;spatial_communication:3;cell_type_mapping:2;3d_reconstruction:1;developmental_trajectory:1;spatial_grn_regulon:1	paper_digests/papers/S0078.md
78	S0079	10.1038/s41422-021-00540-7	2022	Cell Res	Identification of HSC/MPP expansion units in fetal liver by single-cell spatiotemporal transcriptomics.		liver	0	0			paper_digests/papers/S0079.md
79	S0080	10.1038/s41422-023-00831-1	2023	Cell Res	An invasive zone in human liver cancer identified by Stereo-seq promotes hepatocyte-tumor cell crosstalk, local immunosuppression and tumor progression.	human	liver;tumor;cancer	7	7	GSVA:4;pySCENIC:2;Seurat:1;SPOTlight:1;CellPhoneDB:1;GSEA:1;OpenCV:1	spatial_domain:5;spatial_cell_type_interpretation:5;cell_type_mapping:4;publication_plotting:4;spatial_programs:4;cell_cell_interaction:2;spatial_communication:2;quality_control_preprocessing:1;3d_reconstruction:1;spatial_grn_regulon:1	paper_digests/papers/S0080.md
80	S0081	10.1038/s41467-022-29439-6	2022	Nat Commun	Deciphering spatial domains from spatially resolved transcriptomics with an adaptive graph attention auto-encoder.			7	7	Scanpy:5;SpaGCN:2;BayesSpace:2;AnnData:1;SPOTlight:1;Giotto:1	spatial_domain:7;publication_plotting:4;quality_control_preprocessing:3;3d_reconstruction:2;cell_type_mapping:1;spatial_programs:1;developmental_trajectory:1	paper_digests/papers/S0081.md
81	S0082	10.1038/s41467-022-34413-3	2022	Nat Commun	Spatially resolved gene regulatory and disease-related vulnerability map of the adult Macaque cortex.	macaque	cortex	6	8	Seurat:2;SPOTlight:1;Monocle:1;GSEA:1	publication_plotting:7;spatial_programs:6;cell_type_mapping:4;spatial_domain:3;spatial_cell_type_interpretation:1;quality_control_preprocessing:1;cell_cell_interaction:1;developmental_trajectory:1;spatial_communication:1	paper_digests/papers/S0082.md
