selection_rank	paper_id	doi	year	journal	title	species	tissue	figure_count	panel_count	tools_observed	skill_tags	digest_path
82	S0083	10.1038/s41467-022-35288-0	2022	Nat Commun	Spatial-ID: a cell typing method for spatially resolved transcriptomics via transfer learning and spatial embedding.			6	11	Seurat:1;Scanpy:1;RCTD/spacexr:1;SPOTlight:1;cell2location:1;Tangram:1;SingleR:1;SpaGCN:1	cell_type_mapping:10;publication_plotting:6;spatial_domain:5;3d_reconstruction:1;quality_control_preprocessing:1;spatial_cell_type_interpretation:1	paper_digests/papers/S0083.md
83	S0084	10.1038/s41467-023-36796-3	2023	Nat Commun	Spatially informed clustering, integration, and deconvolution of spatial transcriptomics with GraphST.			6	6	GraphST:7;SpaGCN:3;Seurat:2;BayesSpace:2;Giotto:2;Scanpy:2;Harmony:2;cell2location:2;RCTD/spacexr:1;SPOTlight:1;Tangram:1;GSEA:1	spatial_domain:6;spatial_programs:2;publication_plotting:2;cell_type_mapping:2;quality_control_preprocessing:1;spatial_cell_type_interpretation:1	paper_digests/papers/S0084.md
84	S0085	10.1038/s41467-023-42658-9	2023	Nat Commun	Dbh+ catecholaminergic cardiomyocytes contribute to the structure and function of the cardiac conduction system in murine heart.	mouse	heart	9	15	SAW:1;Seurat:1;RCTD/spacexr:1	spatial_domain:10;cell_type_mapping:2;developmental_trajectory:2;publication_plotting:2;quality_control_preprocessing:2;3d_reconstruction:1;spatial_cell_type_interpretation:1	paper_digests/papers/S0085.md
85	S0086	10.1038/s41467-023-43105-5	2023	Nat Commun	Spatial-linked alignment tool (SLAT) for aligning heterogenous slices.			4	5	Seurat:2;Harmony:2;Scanpy:1;pySCENIC:1;GraphST:1	3d_reconstruction:4;spatial_domain:4;cell_type_mapping:3;publication_plotting:3;developmental_trajectory:1	paper_digests/papers/S0086.md
86	S0087	10.1038/s41467-023-44367-9	2024	Nat Commun	MENDER: fast and scalable tissue structure identification in spatial omics data.			6	6	Seurat:1;Scanpy:1;AnnData:1;Tangram:1;SpaGCN:1;BayesSpace:1;Squidpy:1;Harmony:1	spatial_domain:5;publication_plotting:2;cell_type_mapping:1	paper_digests/papers/S0087.md
87	S0088	10.1038/s41467-024-50737-8	2024	Nat Commun	Mapping the molecular landscape of Lotus japonicus nodule organogenesis through spatiotemporal transcriptomics.	lotus	nodule	4	7	Monocle:3;Slingshot:3;SAW:1;Seurat:1;Scanpy:1;Giotto:1;Harmony:1	spatial_domain:6;developmental_trajectory:4;publication_plotting:4;quality_control_preprocessing:4;spatial_programs:3	paper_digests/papers/S0088.md
88	S0089	10.1038/s41467-024-53756-7	2024	Nat Commun	Tracing the evolutionary and genetic footprints of atmospheric tillandsioids transition from land to air.			8	28	Monocle:2;SAW:1;Stereopy:1;Seurat:1;SPIDER:1	spatial_programs:9;spatial_domain:6;spatial_cell_type_interpretation:5;cell_type_mapping:5;developmental_trajectory:3;quality_control_preprocessing:2;publication_plotting:1	paper_digests/papers/S0089.md
89	S0090	10.1038/s41467-024-54710-3	2024	Nat Commun	Spatially organized tumor-stroma boundary determines the efficacy of immunotherapy in colorectal cancer patients.	human	tumor;cancer	6	7	RCTD/spacexr:3;GSEA:2;Seurat:1;Scanpy:1;AnnData:1;Monocle:1;Slingshot:1	publication_plotting:6;spatial_domain:6;spatial_programs:3;cell_type_mapping:3;spatial_cell_type_interpretation:2;cell_cell_interaction:2;spatial_communication:2;developmental_trajectory:1	paper_digests/papers/S0090.md
90	S0091	10.1038/s41467-024-54715-y	2025	Nat Commun	Stereo-seq of the prefrontal cortex in aging and Alzheimer's disease.		cortex	7	12	SAW:1;Stereopy:1;Scanpy:1;CellChat:1;Harmony:1	spatial_domain:9;publication_plotting:7;spatial_programs:3;quality_control_preprocessing:2;cell_cell_interaction:2;spatial_communication:2;spatial_cell_type_interpretation:1	paper_digests/papers/S0091.md
91	S0092	10.1038/s41467-025-56501-w	2025	Nat Commun	Cloned airway basal progenitor cells to repair fibrotic lung through re-epithelialization.		lung	5	13	SAW:1;Seurat:1	3d_reconstruction:2;quality_control_preprocessing:2;spatial_domain:2;developmental_trajectory:1;publication_plotting:1;spatial_programs:1	paper_digests/papers/S0092.md
92	S0093	10.1038/s41467-025-58079-9	2025	Nat Commun	Stereopy: modeling comparative and spatiotemporal cellular heterogeneity via multi-sample spatial transcriptomics.			5	7	Stereopy:7;Seurat:2;Scanpy:2;Giotto:2;AnnData:1;SingleR:1;CellPhoneDB:1;NicheNet:1;SpaGRN:1;GraphST:1;SpaGCN:1;Squidpy:1	developmental_trajectory:5;3d_reconstruction:4;spatial_programs:4;publication_plotting:4;spatial_domain:4;cell_type_mapping:4;spatial_cell_type_interpretation:3;spatial_grn_regulon:2;cell_cell_interaction:1;spatial_communication:1	paper_digests/papers/S0093.md
93	S0094	10.1038/s41467-025-58511-0	2025	Nat Commun	Spatially resolved atlas of breast cancer uncovers intercellular machinery of venular niche governing lymphocyte extravasation.		cancer	7	7	RCTD/spacexr:2;CellChat:2;SAW:1;Seurat:1;GSEA:1;Harmony:1	cell_type_mapping:6;publication_plotting:6;quality_control_preprocessing:6;spatial_cell_type_interpretation:5;spatial_domain:4;spatial_programs:4;cell_cell_interaction:2;spatial_communication:2;developmental_trajectory:1	paper_digests/papers/S0094.md
94	S0095	10.1038/s41467-025-58614-8	2025	Nat Commun	Single-nucleus and spatial transcriptomics identify brain landscape of gene regulatory networks associated with behavioral maturation in honeybees.		brain	7	11	Seurat:4;Tangram:3;pySCENIC:2;SAW:1	spatial_domain:8;cell_type_mapping:6;publication_plotting:4;spatial_programs:4;quality_control_preprocessing:3;spatial_grn_regulon:2;spatial_cell_type_interpretation:1	paper_digests/papers/S0095.md
95	S0096	10.1038/s41467-025-59070-0	2025	Nat Commun	An organ-wide spatiotemporal transcriptomic and cellular atlas of the regenerating zebrafish heart.	zebrafish	heart	5	5	Seurat:1;AnnData:1;RCTD/spacexr:1;CellChat:1;scVelo:1;GSEA:1;Harmony:1	publication_plotting:4;spatial_domain:4;cell_type_mapping:3;developmental_trajectory:3;spatial_programs:2;cell_cell_interaction:1;spatial_communication:1;spatial_grn_regulon:1;3d_reconstruction:1	paper_digests/papers/S0096.md
96	S0097	10.1038/s41467-025-62793-9	2025	Nat Commun	Charting the spatial transcriptome of the human cerebral cortex at single-cell resolution.	human	cortex	8	9	RCTD/spacexr:2;SAW:1;Stereopy:1;Seurat:1;Scanpy:1;CellChat:1;Harmony:1	spatial_domain:9;publication_plotting:8;quality_control_preprocessing:7;spatial_programs:7;cell_type_mapping:5;spatial_cell_type_interpretation:3;cell_cell_interaction:1;spatial_communication:1	paper_digests/papers/S0097.md
97	S0098	10.1038/s41467-025-64292-3	2025	Nat Commun	Systematic benchmarking of high-throughput subcellular spatial transcriptomics platforms across human tumors.	human	tumor	6	7	SAW:1;Seurat:1;Scanpy:1;Tangram:1;CellPhoneDB:1;OpenCV:1;SimpleITK:1	quality_control_preprocessing:6;spatial_domain:6;spatial_cell_type_interpretation:3;cell_type_mapping:2;developmental_trajectory:1;3d_reconstruction:1;publication_plotting:1	paper_digests/papers/S0098.md
98	S0099	10.1038/s41477-023-01387-z	2023	Nat Plants	Integrated single-nucleus and spatial transcriptomics captures transitional states in soybean nodule maturation.	soybean	nodule	0	0			paper_digests/papers/S0099.md
99	S0100	10.1038/s41477-024-01683-2	2024	Nat Plants	A spatial transcriptome map of the developing maize ear.	maize		0	0			paper_digests/papers/S0100.md
100	S0101	10.1038/s41477-025-01950-w	2025	Nat Plants	Developmental innovation of inferior ovaries and flower sex orchestrated by KNOX1 in cucurbits.			0	0			paper_digests/papers/S0101.md
101	S0102	10.1038/s41556-023-01108-w	2023	Nat Cell Biol	A single-cell transcriptome atlas profiles early organogenesis in human embryos.	human	embryo	0	0			paper_digests/papers/S0102.md
102	S0103	10.1038/s41556-024-01597-3	2025	Nat Cell Biol	Spatial transcriptomic characterization of a Carnegie stage 7 human embryo.	human	embryo	0	0			paper_digests/papers/S0103.md
103	S0104	10.1038/s41586-022-05242-7	2022	Nature	A cellular hierarchy in melanoma uncouples growth and metastasis.			0	0			paper_digests/papers/S0104.md
104	S0105	10.1038/s41586-024-07563-1	2024	Nature	Multiscale topology classifies cells in subcellular spatial transcriptomics.			11	16	RCTD/spacexr:2;Seurat:1;SPOTlight:1;cell2location:1;Tangram:1;Harmony:1	spatial_domain:9;cell_type_mapping:6;quality_control_preprocessing:4;publication_plotting:4;cell_cell_interaction:1;spatial_communication:1;spatial_programs:1	paper_digests/papers/S0105.md
105	S0106	10.1038/s41586-025-08757-x	2025	Nature	Spatially resolved mapping of cells associated with human complex traits.	human		15	18	Seurat:1;Scanpy:1;AnnData:1;SpaGCN:1	spatial_domain:13;cell_type_mapping:7;publication_plotting:4;spatial_programs:4;quality_control_preprocessing:3;spatial_cell_type_interpretation:1	paper_digests/papers/S0106.md
106	S0107	10.1038/s41586-025-08880-9	2025	Nature	Psychedelic control of neuroimmune interactions governing fear.			0	0			paper_digests/papers/S0107.md
107	S0108	10.1038/s41588-023-01546-0	2023	Nat Genet	Chromosome-level genomes of three key Allium crops and their trait evolution.			0	0			paper_digests/papers/S0108.md
108	S0109	10.1038/s41588-023-01570-0	2023	Nat Genet	Multiomic analysis of cervical squamous cell carcinoma identifies cellular ecosystems with biological and clinical relevance.		carcinoma	0	0			paper_digests/papers/S0109.md
109	S0110	10.1038/s41588-024-01687-w	2024	Nat Genet	A spatiotemporal atlas of cholestatic injury and repair in mice.	mouse		0	0			paper_digests/papers/S0110.md
110	S0111	10.1038/s41588-024-01709-7	2024	Nat Genet	A spatiotemporal atlas of mouse liver homeostasis and regeneration.	mouse	liver	0	0			paper_digests/papers/S0111.md
111	S0112	10.1038/s41588-025-02341-9	2025	Nat Genet	Single-cell multi-omic and spatial profiling of esophageal squamous cell carcinoma reveals the immunosuppressive role of GPR116+ pericytes in cancer metastasis.		cancer;carcinoma	0	0			paper_digests/papers/S0112.md
112	S0113	10.1038/s41591-025-03592-z	2025	Nat Med	Single-cell profiling of the human endometrium in polycystic ovary syndrome.	human		14	14	CellChat:5;GSEA:2;Seurat:2;SAW:1;Stereopy:1;AnnData:1;SingleR:1	spatial_domain:13;publication_plotting:12;spatial_programs:10;cell_type_mapping:7;cell_cell_interaction:6;spatial_communication:6;quality_control_preprocessing:3;developmental_trajectory:2;spatial_cell_type_interpretation:1	paper_digests/papers/S0113.md
113	S0114	10.1038/s41592-024-02316-4	2024	Nat Methods	Deciphering spatial domains from spatial multi-omics with SpatialGlue.			14	14	Seurat:11;Scanpy:1;GraphST:1;SpaGCN:1	spatial_domain:13;spatial_programs:3;publication_plotting:3;quality_control_preprocessing:2;cell_type_mapping:2;3d_reconstruction:1	paper_digests/papers/S0114.md
114	S0115	10.1038/s41592-025-02658-7	2025	Nat Methods	Tri-omic single-cell mapping of the 3D epigenome and transcriptome in whole mouse brains throughout the lifespan.	mouse	brain	0	0			paper_digests/papers/S0115.md
115	S0116	10.1038/s41597-025-05838-4	2025	Sci Data	A dataset of spatially resolved transcriptomics of post-natal cardiac development in mice.	mouse		6	6	SAW:1;Seurat:1;SingleR:1	quality_control_preprocessing:5;publication_plotting:3;spatial_domain:2;cell_type_mapping:1	paper_digests/papers/S0116.md
116	S0117	10.1038/s41698-023-00430-8	2023	NPJ Precis Oncol	Clonal dynamics and Stereo-seq resolve origin and phenotypic plasticity of adenosquamous carcinoma.		carcinoma	7	7	Stereopy:1;Seurat:1;Scanpy:1	developmental_trajectory:1;spatial_domain:1	paper_digests/papers/S0117.md
117	S0118	10.1038/s42255-022-00713-7	2023	Nat Metab	Implantation underneath the abdominal anterior rectus sheath enables effective and functional engraftment of stem-cell-derived islets.			0	0			paper_digests/papers/S0118.md
118	S0119	10.1038/s43018-023-00672-2	2024	Nat Cancer	Presence of onco-fetal neighborhoods in hepatocellular carcinoma is associated with relapse and response to immunotherapy.		carcinoma	0	0			paper_digests/papers/S0119.md
119	S0120	10.1038/s43587-024-00672-6	2024	Nat Aging	Maternal age enhances purifying selection on pathogenic mutations in complex I genes of mammalian mtDNA.			0	0			paper_digests/papers/S0120.md
120	S0121	10.1038/s43587-025-00857-7	2025	Nat Aging	Quasi-spatial single-cell transcriptome based on physical tissue properties defines early aging associated niche in liver.		liver	0	0			paper_digests/papers/S0121.md
121	S0122	10.1038/s43587-025-00909-y	2025	Nat Aging	Age-dependent accumulation of mitochondrial tRNA mutations in mouse kidneys linked to mitochondrial kidney diseases.	mouse	kidney	0	0			paper_digests/papers/S0122.md
122	S0123	10.1038/s44161-025-00639-9	2025	Nat Cardiovasc Res	Single-cell spatial transcriptomics of tertiary lymphoid organ-like structures in human atherosclerotic plaques.	human		0	0			paper_digests/papers/S0123.md
123	S0124	10.1073/pnas.2310163120	2023	Proc Natl Acad Sci U S A	Spatial transcriptomics reveals light-induced chlorenchyma cells involved in promoting shoot regeneration in tomato callus.			5	14	SAW:1;Seurat:1;scVelo:1;dynamo:1	spatial_programs:7;spatial_domain:6;publication_plotting:4;cell_type_mapping:2;quality_control_preprocessing:2;spatial_cell_type_interpretation:1;developmental_trajectory:1	paper_digests/papers/S0124.md
124	S0125	10.1073/pnas.2408939121	2024	Proc Natl Acad Sci U S A	Lamination-based organoid spatially resolved transcriptomics technique for primary lung and liver organoid characterization.		lung;liver	4	4	Stereopy:1	spatial_domain:4;cell_type_mapping:3;publication_plotting:3	paper_digests/papers/S0125.md
125	S0126	10.1073/pnas.2417445122	2025	Proc Natl Acad Sci U S A	DDX24 spatiotemporally orchestrates VEGF and Wnt signaling during developmental angiogenesis.			6	6	NicheNet:2;GSEA:1	developmental_trajectory:3;spatial_cell_type_interpretation:3;spatial_programs:3;cell_type_mapping:2;quality_control_preprocessing:2;spatial_domain:2;3d_reconstruction:1;cell_cell_interaction:1;publication_plotting:1;spatial_communication:1	paper_digests/papers/S0126.md
126	S0127	10.1073/pnas.2420466122	2025	Proc Natl Acad Sci U S A	An atlas of early human mandibular endochondral and osteogenic paracrine signaling regions of Meckel's cartilage.	human		6	6	Seurat:1;CellChat:1;CellPhoneDB:1;Harmony:1	publication_plotting:5;developmental_trajectory:4;spatial_domain:4;cell_type_mapping:2;cell_cell_interaction:2;spatial_communication:2;3d_reconstruction:1;spatial_cell_type_interpretation:1;spatial_programs:1;spatial_grn_regulon:1	paper_digests/papers/S0127.md
127	S0128	10.1093/bib/bbae250	2024	Brief Bioinform	Benchmarking mapping algorithms for cell-type annotating in mouse brain by integrating single-nucleus RNA-seq and Stereo-seq data.	mouse	brain	5	5	RCTD/spacexr:2;Seurat:1;AnnData:1;cell2location:1;Tangram:1;Giotto:1	spatial_domain:4;cell_type_mapping:4;publication_plotting:2;quality_control_preprocessing:1	paper_digests/papers/S0128.md
128	S0129	10.1093/bib/bbaf210	2025	Brief Bioinform	StereoMM: a graph fusion model for integrating spatial transcriptomic data and pathological images.			6	6	GSEA:3;Stereopy:1;Scanpy:1;AnnData:1;cell2location:1;SpaGCN:1	spatial_programs:5;spatial_domain:5;publication_plotting:4;cell_cell_interaction:2;spatial_communication:2;spatial_cell_type_interpretation:2;quality_control_preprocessing:1;spatial_grn_regulon:1	paper_digests/papers/S0129.md
129	S0130	10.1093/bjd/ljae459	2025	Br J Dermatol	Multitranscriptome analysis reveals stromal cells in the papillary dermis to promote angiogenesis in psoriasis vulgaris.			0	0			paper_digests/papers/S0130.md
130	S0131	10.1093/gigascience/giae042	2024	Gigascience	spatiAlign: an unsupervised contrastive learning model for data integration of spatially resolved transcriptomics.			5	36	Seurat:1;Scanpy:1;GraphST:1;SpaGCN:1;BayesSpace:1;Harmony:1	publication_plotting:14;spatial_domain:11;cell_type_mapping:8;spatial_programs:4;quality_control_preprocessing:4;developmental_trajectory:2;spatial_cell_type_interpretation:2;3d_reconstruction:1	paper_digests/papers/S0131.md
131	S0132	10.1093/gpbjnl/qzaf053	2025	Genomics Proteomics Bioinformatics	Spatial Transcriptomics Unveils the Blueprint of Mammalian Lung Development.		lung	0	0			paper_digests/papers/S0132.md
132	S0133	10.1093/hr/uhaf243	2025	Hortic Res	Uncovering the genetic architecture of pungency, carotenoids, and flavor in Capsicum chinense via TWAS-mGWAS integration and spatial transcriptomics.			5	9		spatial_programs:4;publication_plotting:3;quality_control_preprocessing:2;spatial_domain:2;spatial_cell_type_interpretation:1;spatial_grn_regulon:1	paper_digests/papers/S0133.md
133	S0134	10.1093/jmcb/mjaf032	2026	J Mol Cell Biol	The tumor-associated fibroblasts regulate urothelial carcinoma progression.		tumor;carcinoma	6	6	CellPhoneDB:2;Seurat:1;SPOTlight:1;Monocle:1;pySCENIC:1;GSVA:1;GSEA:1;Harmony:1	spatial_domain:4;publication_plotting:3;cell_type_mapping:2;spatial_programs:2;cell_cell_interaction:1;spatial_communication:1;spatial_cell_type_interpretation:1	paper_digests/papers/S0134.md
134	S0135	10.1093/nar/gkad419	2023	Nucleic Acids Res	STellaris: a web server for accurate spatial mapping of single cells based on spatial transcriptomics data.			4	4	Seurat:1;Scanpy:1;cell2location:1;Tangram:1;CellPhoneDB:1	cell_type_mapping:3;publication_plotting:3;cell_cell_interaction:1;spatial_communication:1;spatial_domain:1	paper_digests/papers/S0135.md
135	S0136	10.1093/nar/gkad933	2024	Nucleic Acids Res	STOmicsDB: a comprehensive database for spatial transcriptomics data sharing, analysis and visualization.			5	5	Scanpy:1;AnnData:1;SingleR:1	spatial_programs:1	paper_digests/papers/S0136.md
136	S0137	10.1093/nargab/lqaf044	2025	NAR Genom Bioinform	Fast analysis of Spatial Transcriptomics (FaST): an ultra lightweight and fast pipeline for the analysis of high resolution spatial transcriptomics.			4	7	Scanpy:3;AnnData:3;Seurat:1;spateo:1	spatial_domain:4;publication_plotting:2;cell_type_mapping:1	paper_digests/papers/S0137.md
137	S0138	10.1093/nsr/nwaf388	2025	National Science Review	Microglial function alterations during healthy ageing and canine cognitive dysfunction revealed by single-nucleus and spatial transcriptomics			0	0			paper_digests/papers/S0138.md
138	S0139	10.1093/plcell/koaf253	2025	Plant Cell	Single-cell and spatial omics reveal progressive loss of xylem developmental complexity across seed plants.		xylem	0	0			paper_digests/papers/S0139.md
139	S0140	10.1097/hc9.0000000000000662	2025	Hepatol Commun	Integrative single-cell and spatial transcriptome analysis reveals heterogeneity of human liver progenitor cells.	human	liver	10	36	Monocle:2;GSEA:2;SAW:1;Seurat:1;RCTD/spacexr:1;Harmony:1	spatial_programs:16;publication_plotting:15;spatial_domain:8;developmental_trajectory:6;cell_type_mapping:5;quality_control_preprocessing:1;spatial_cell_type_interpretation:1	paper_digests/papers/S0140.md
140	S0141	10.1101/2025.01.14.632962	2025		Mapping spatially-resolved transcriptomes in systemic sclerosis			0	0			paper_digests/papers/S0141.md
141	S0142	10.1101/gr.277670.123	2023	Genome Res	Partial alignment of multislice spatially resolved transcriptomics data.			5	5	Tangram:2;SimpleITK:1	3d_reconstruction:5;cell_type_mapping:2;spatial_domain:1	paper_digests/papers/S0142.md
142	S0143	10.1101/gr.279857.124	2025	Genome Res	Dissecting multilayer cell-cell communications with signaling feedback loops from spatial transcriptomics data.			5	7	stMLnet:6;NicheNet:2;COMMOT:2;CellChat:1;CellPhoneDB:1;Squidpy:1;Giotto:1	spatial_domain:6;cell_cell_interaction:4;cell_type_mapping:4;spatial_communication:4;publication_plotting:3;quality_control_preprocessing:2;spatial_grn_regulon:1;spatial_programs:1;spatial_cell_type_interpretation:1	paper_digests/papers/S0143.md
143	S0144	10.1111/nph.70160	2025	New Phytol	Single-cell multiome reveals root hair-specific responses to salt stress.		root	6	33	pySCENIC:2;Seurat:1;Scanpy:1	publication_plotting:11;cell_type_mapping:11;spatial_domain:7;spatial_grn_regulon:4;quality_control_preprocessing:3;spatial_programs:3;developmental_trajectory:3	paper_digests/papers/S0144.md
144	S0145	10.1111/pbi.13884	2022	Plant Biotechnol J	Spatial transcriptome analysis on peanut tissues shed light on cell heterogeneity of the peg.			1	8	Monocle:1	spatial_domain:3;publication_plotting:2;spatial_cell_type_interpretation:2	paper_digests/papers/S0145.md
145	S0146	10.1111/pbi.14294	2024	Plant Biotechnol J	Spatiotemporal transcriptomic atlas of rhizome formation in Oryza longistaminata.			6	44	SAW:1;Stereopy:1;Seurat:1;dynamo:1;Giotto:1;Harmony:1	spatial_domain:14;publication_plotting:9;developmental_trajectory:7;3d_reconstruction:2;spatial_programs:1	paper_digests/papers/S0146.md
146	S0147	10.1111/pbi.70351	2025	Plant Biotechnol J	Spatial Transcriptomics of Developing Wheat Seed Reveals Concentric Gene Expression Zones and Subgenome Biased Expression of Key Genes.			5	34	SAW:1;Stereopy:1	spatial_domain:12;quality_control_preprocessing:2;3d_reconstruction:1	paper_digests/papers/S0147.md
147	S0148	10.1126/sciadv.adi4777	2023	Sci Adv	Adrenomedullin has a pivotal role in trophoblast differentiation: A promising nanotechnology-based therapeutic target for early-onset preeclampsia.			8	21	Scanpy:1;cell2location:1	developmental_trajectory:6;spatial_domain:4;publication_plotting:2;spatial_grn_regulon:2;quality_control_preprocessing:2;cell_type_mapping:1;spatial_programs:1	paper_digests/papers/S0148.md
148	S0149	10.1126/sciadv.adi9035	2024	Sci Adv	Spatially resolved single-cell atlas of ascidian endostyle provides insight into the origin of vertebrate pharyngeal organs.	ascidian		5	8	SAW:1;Seurat:1;CellChat:1;Monocle:1;dynamo:1	spatial_domain:5;developmental_trajectory:4;publication_plotting:4;spatial_cell_type_interpretation:2;spatial_programs:2;cell_type_mapping:2;cell_cell_interaction:1;spatial_communication:1;spatial_grn_regulon:1	paper_digests/papers/S0149.md
149	S0150	10.1126/science.abp9444	2022	Science	Single-cell Stereo-seq reveals induced progenitor cells involved in axolotl brain regeneration.		brain	0	0			paper_digests/papers/S0150.md
150	S0151	10.1126/science.adj9198	2024	Science	Whole-brain spatial organization of hippocampal single-neuron projectomes.		brain	0	0			paper_digests/papers/S0151.md
151	S0152	10.1126/science.ado3927	2024	Science	Cross-species single-cell spatial transcriptomic atlases of the cerebellar cortex.		cortex	0	0			paper_digests/papers/S0152.md
152	S0153	10.1126/science.adp0176	2025	Science	Reactivation of mammalian regeneration by turning on an evolutionarily disabled genetic switch.			0	0			paper_digests/papers/S0153.md
153	S0154	10.1126/science.adr0475	2025	Science	Stereo-cell: Spatial enhanced-resolution single-cell sequencing with high-density DNA nanoball-patterned arrays.			0	0			paper_digests/papers/S0154.md
154	S0155	10.1136/jitc-2023-sitc2023.1512	2023	Late-Breaking Abstracts	1512 Single-cell resolution spatial transcriptomics detection of pathogens followed by studying the immune milieu: using virus-associated cancers from different organs as paradigm		cancer	0	0			paper_digests/papers/S0155.md
155	S0156	10.1136/jitc-2024-sitc2024.0172	2024	Regular and Young Investigator Award Abstracts	172 The application of single-cell resolved spatial transcriptomics to prostate adenocarcinoma reveals tumor microenvironmental signatures that correlate with distinct histological features		tumor;carcinoma	0	0			paper_digests/papers/S0156.md
156	S0157	10.1136/jitc-2024-sitc2024.1144	2024	Regular and Young Investigator Award Abstracts	1144 Combined CAR-M and T cell therapy to remodel TGFbeta-rich solid tumors		tumor	0	0			paper_digests/papers/S0157.md
157	S0158	10.1158/0008-5472.can-24-1509	2025	Cancer Res	Spatial and Single-Cell Analyses Reveal Heterogeneity of DNAM-1 Receptor-Ligand Interactions That Instructs Intratumoral γδT-cell Activity.		tumor	8	8	Monocle:2;SAW:1;Seurat:1;spateo:1;GSVA:1;GSEA:1;Harmony:1	cell_type_mapping:3;publication_plotting:3;spatial_programs:3;spatial_cell_type_interpretation:2;spatial_domain:1;cell_cell_interaction:1;spatial_communication:1;developmental_trajectory:1	paper_digests/papers/S0158.md
158	S0159	10.1158/1538-7445.am2025-151	2025	Cancer Research	Abstract 151: Spatial patterns of APOBEC mutagenesis in the tumor microenvironment of Asian breast cancer		tumor;cancer	0	0			paper_digests/papers/S0159.md
159	S0160	10.1158/1538-7445.am2025-5302	2025	Cancer Research	Abstract 5302: Mapping the tumor microenvironment at single-cell resolution with Stereo-seq v1.3		tumor	0	0			paper_digests/papers/S0160.md
160	S0161	10.1158/2159-8290.cd-24-0605	2025	Cancer Discov	Spatially Resolved Tumor Ecosystems and Cell States in Gastric Adenocarcinoma Progression and Evolution.		tumor;carcinoma	7	9	GSEA:3;Scanpy:2;SAW:1;Stereopy:1;Seurat:1;Monocle:1;Slingshot:1;GSVA:1	publication_plotting:9;spatial_domain:8;cell_type_mapping:4;spatial_programs:3;developmental_trajectory:1;quality_control_preprocessing:1;spatial_cell_type_interpretation:1	paper_digests/papers/S0161.md
161	S0162	10.1177/00220345241232317	2024	J Dent Res	Spatiotemporal Evolution of Developing Palate in Mice.	mouse	palate	0	0			paper_digests/papers/S0162.md
162	S0163	10.1182/blood-2024-207103	2024	Blood	Clinical Features of Cutaneous T-Cell Lymphoma and the Application of Anti-PD-1 Antibodies in Relapsed /Refractory Patients	human		0	0			paper_digests/papers/S0163.md
163	S0164	10.1182/blood.2023021992	2024	Blood	Single-cell landscape of idiopathic multicentric Castleman disease in identical twins.			0	0			paper_digests/papers/S0164.md
164	S0165	10.1186/s12864-024-10672-w	2024	BMC Genomics	Spatial transcriptome reveals the region-specific genes and pathways regulated by Satb2 in neocortical development.			4	5	SAW:1;Stereopy:1;Seurat:1;Monocle:1	spatial_domain:3;developmental_trajectory:2;publication_plotting:1;quality_control_preprocessing:1;spatial_programs:1	paper_digests/papers/S0165.md
